{
  "$schema": "https://json-schema.org/draft/2020-12/schema",
  "$id": "https://wellmanifest.com/schemas/nohardcode-policy.schema.json",
  "title": "Wellmanifest No-Hardcode Policy",
  "description": "Defines repository-level thresholds, dynamic engine bindings, and allowed exceptions for unhardcoding.",
  "type": "object",
  "required": ["schema", "version", "engine_bindings", "rules"],
  "properties": {
    "schema": {
      "type": "string",
      "const": "wellmanifest.nohardcode/policy/v1"
    },
    "version": {
      "type": "string",
      "pattern": "^[0-9]+\\.[0-9]+\\.[0-9]+(-[a-z0-9.]+)?$"
    },
    "profile": {
      "type": "string",
      "enum": ["strict", "balanced", "permissive"],
      "default": "balanced"
    },
    "engine_bindings": {
      "type": "object",
      "description": "Configured dynamic technologies replacing hardcoded patterns",
      "properties": {
        "llm": {
          "type": "object",
          "properties": {
            "enabled": { "type": "boolean", "default": true },
            "provider": { "type": "string", "enum": ["subllm", "ollama", "direct", "none"] },
            "model": { "type": "string" },
            "temperature": { "type": "number", "minimum": 0.0, "maximum": 1.0 },
            "timeout_ms": { "type": "integer", "default": 2000 }
          },
          "required": ["enabled"]
        },
        "vision_yolo": {
          "type": "object",
          "properties": {
            "enabled": { "type": "boolean", "default": true },
            "model_path": { "type": "string" },
            "confidence_threshold": { "type": "number", "minimum": 0.0, "maximum": 1.0, "default": 0.65 }
          },
          "required": ["enabled"]
        },
        "ocr_tesseract": {
          "type": "object",
          "properties": {
            "enabled": { "type": "boolean", "default": true },
            "languages": { "type": "string", "default": "pol+eng" },
            "confidence_threshold": { "type": "number", "default": 60.0 }
          },
          "required": ["enabled"]
        },
        "rule_engine_jev": {
          "type": "object",
          "properties": {
            "enabled": { "type": "boolean", "default": true },
            "policy_store_uri": { "type": "string" }
          },
          "required": ["enabled"]
        },
        "secrets_vault": {
          "type": "object",
          "properties": {
            "enabled": { "type": "boolean", "default": true },
            "standard_ref": { "type": "string", "default": "wellmanifest/secrets@v1" }
          },
          "required": ["enabled"]
        },
        "env_dsl": {
          "type": "object",
          "properties": {
            "enabled": { "type": "boolean", "default": true },
            "standard_ref": { "type": "string", "default": "wellmanifest/env-dsl@v1" }
          },
          "required": ["enabled"]
        },
        "adaptive_budget": {
          "type": "object",
          "properties": {
            "enabled": { "type": "boolean", "default": true },
            "strategy": { "type": "string", "enum": ["ewma_latency", "exponential_jitter", "circuit_breaker", "dynamic_token_budget"] },
            "max_backoff_sec": { "type": "number", "default": 60.0 }
          },
          "required": ["enabled"]
        },
        "schema_extractor": {
          "type": "object",
          "properties": {
            "enabled": { "type": "boolean", "default": true },
            "fallback_to_llm": { "type": "boolean", "default": true },
            "tolerant_tree_traversal": { "type": "boolean", "default": true }
          },
          "required": ["enabled"]
        },
        "model_router": {
          "type": "object",
          "properties": {
            "enabled": { "type": "boolean", "default": true },
            "routing_tier": { "type": "string", "enum": ["capability", "cost_latency", "offline_first"] },
            "fallback_chain": { "type": "array", "items": { "type": "string" } }
          },
          "required": ["enabled"]
        },
        "dag_planner": {
          "type": "object",
          "properties": {
            "enabled": { "type": "boolean", "default": true },
            "standard_ref": { "type": "string", "default": "wellmanifest/poa@v1" },
            "self_repair_loop": { "type": "boolean", "default": true }
          },
          "required": ["enabled"]
        },
        "hardware_probe": {
          "type": "object",
          "properties": {
            "enabled": { "type": "boolean", "default": true },
            "probe_accelerator": { "type": "boolean", "default": true },
            "dynamic_display_detection": { "type": "boolean", "default": true }
          },
          "required": ["enabled"]
        },
        "fuzzy_phonetic": {
          "type": "object",
          "properties": {
            "enabled": { "type": "boolean", "default": true },
            "algorithm": { "type": "string", "enum": ["double_metaphone", "levenshtein", "embedding_cosine", "hybrid"] },
            "max_distance": { "type": "integer", "default": 2 }
          },
          "required": ["enabled"]
        },
        "adaptive_ranking": {
          "type": "object",
          "properties": {
            "enabled": { "type": "boolean", "default": true },
            "strategy": { "type": "string", "enum": ["thompson_sampling", "ucb1", "decaying_feedback"] }
          },
          "required": ["enabled"]
        }
      },
      "additionalProperties": false
    },
    "rules": {
      "type": "object",
      "description": "Rule enablement and severity overrides",
      "additionalProperties": {
        "type": "object",
        "properties": {
          "enabled": { "type": "boolean" },
          "severity": { "type": "string", "enum": ["error", "warning", "info"] },
          "threshold": { "type": ["integer", "number"] }
        },
        "required": ["enabled", "severity"]
      }
    },
    "exclusions": {
      "type": "array",
      "items": { "type": "string" },
      "description": "Glob patterns excluded from unhardcode audit (e.g. fixtures, test mocks)"
    },
    "waivers": {
      "type": "array",
      "description": "Reviewed exceptions for formats without comments (JSON); findings stay in the report as waived",
      "items": {
        "type": "object",
        "required": ["path", "rule", "reason"],
        "properties": {
          "path": { "type": "string", "minLength": 1, "pattern": "^(?!/)(?!(.*/)?\\.\\.(/|$))[^*?\\[\\\\]+$" },
          "rule": { "type": "string", "pattern": "^NOHARDCODE-[0-9]{3}$" },
          "reason": { "type": "string", "pattern": "\\S" },
          "match": { "type": "string", "minLength": 1 }
        },
        "additionalProperties": false
      }
    }
  },
  "additionalProperties": false
}
